2;10528;101;1;12.4;Gayle;Tiwary;1 run; full ball hit to long-off for one
2;10590;102;1;12.5;Gayle;Tendulkar;1 run; worked off the hips for a single to square leg
2;10619;106;1;12.6;Gayle;Tiwary;FOUR; and Tiwary is at it again, length ball, and he muscles it down the ground, and damn straight, four more, we are headed towards a quick finish
2;10723;110;1;13.1;Sharma;Tendulkar;FOUR; Nothing has changed here son! When he was taken off the attack, Tendulkar was hitting Ishant for fours. He comes back, bowls first ball on a length, and Tendulkar lofts him over midwicket
2;10783;114;1;13.2;Sharma;Tendulkar;FOUR; length again, and he has been smashed past midwicket again! Tough love from the senior man of his international side
2;10811;116;1;13.3;Sharma;Tendulkar;2 runs; gets the yorker in, and he gets into the gap on the on side and keeps the strike again
2;10812;116;1;13.4;Sharma;Tendulkar;no run; slower legcutter, Tendulkar looks to guide it past the keeper but is beaten
2;10908;117;1;13.5;Sharma;Tendulkar;1 run; full ball outside off, and he flicks it to on, he is just toying with Ishant
2;10909;117;1;13.6;Sharma;Tiwary;OUT; Ganguly takes a second good catch off the night! Tiwary is looking extra cover but it is too short for the shot, and he ends up seemingly lobbing it over Dada at short extra, but he times the jump to perfection and pulls off a one-handed stunner
2;11082;119;2;14.1;Kartik;Tendulkar;2 runs; flighted outside off, looks to play to on, gets a leading edge but it travels so slowly to long-on that he can come back for two
2;11109;120;2;14.2;Kartik;Tendulkar;1 run; pushes one to long-on for a single
2;11110;120;2;14.3;Kartik;Pollard;no run; flat ball, Pollard looks to cut but it is too full
2;11111;120;2;14.4;Kartik;Pollard;no run; gets the big front foot down and defends
2;11182;121;2;14.5;Kartik;Pollard;1 run; teases Karthik, this is flighted, he stays back, and gets the bat down just when Karthik is thinking of an lbw appeal
2;11210;122;2;14.6;Kartik;Tendulkar;1 run; flat delivery on off, worked away for one to long-on
2;11288;123;2;15.1;Sharma;Tendulkar;1 run; gets this one right into the block hole, just a single to long-on
2;11291;123;2;15.2;Sharma;Pollard;no run; gets the yorker right again, and Pollard hits it back to him
2;11394;125;2;15.3;Sharma;Pollard;2 runs; nicely bowled, slower ball, not easy to pick, Pollard adjusts well, keeps the pull down, and finds a gap to be able to come back for two
2;11435;129;2;15.4;Sharma;Pollard;FOUR; who says Pollard can't be delicate, he has guided this length delivery expertly between short third man and backward point
2;11436;129;2;15.5;Sharma;Pollard;OUT; and Pollard has followed up a nice shot with a daft one, plays all across the line of a length delivery, Ishant is full and straight at the right time, and collects a plumb lbw verdict
2;11457;129;2;15.6;Sharma;Sathish;no run; and Ishant bowls a bouncer right away, Sathish slam-ducks it, almost Sampras like, but two-handed - awkward shot, but he is safe as he has hit it into the ground
2;11763;130;3;16.1;Kartik;Tendulkar;1 run; and he gets another leading edge out of Tendulkar who is bent at playing him to on, but again the edge is safe and he gets a single to point
2;11800;131;3;16.2;Kartik;Sathish;1 run;
2;11812;132;3;16.3;Kartik;Tendulkar;1 run; flat into the pads, easily worked away for one
2;11828;136;3;16.4;Kartik;Sathish;FOUR; oh it's a tough shot made to look easy, makes room early, gives Karthik three stumps to aim at, and he bowls flat and Sathish meets it with an open face and places it between short third and backward point
2;11864;138;3;16.5;Kartik;Sathish;2 runs; nice chip shot over extra cover, only looking to clear infield and does that
2;11884;139;3;16.6;Kartik;Sathish;1 run; opens the face again, and gets just a single this time, but quick running from SRT
2;11970;143;3;17.1;Bond;Sathish;FOUR; starts off with a slower ball, Sathish stays back and almost as if he is expecting it, he waits for it to arrive and lofts it over cover
2;12023;147;3;17.2;Bond;Sathish;FOUR; and Sathish gets another boundary, not where he intended this one, though. Looks to whip it over leg, gets a leading edge over point and into the gap
2;12043;148;3;17.3;Bond;Sathish;1 run; clears the front leg and pulls this one for one
2;12076;150;3;17.4;Bond;Tendulkar;2 runs; slower ball, and steered to wide of third man for two
2;12110;151;3;17.5;Bond;Tendulkar;1 run; dabbed to third man for one
2;12150;152;3;17.6;Bond;Sathish;1 run; slapped to mid-on, comes though for one and makes it despite a direct-hit from Karthik
2;12271;153;3;18.1;Mathews;Sathish;1 run; yorker, hit to sweeper-cover for one
2;12319;154;3;18.2;Mathews;Tendulkar;1 run; full on the pads, hit straight to short fine
2;12364;156;3;18.3;Mathews;Sathish;2 runs; and he has ended the match with his second vertical-bat pull, fine of fine leg this time
